text,emotion,source
The retail forecast gives me mixed feelings; is summer shopping season in jeopardy?,uncertainty,synthetic
Can anyone decipher the latest news on inflation? I'm feeling lost.,uncertainty,synthetic
"Earnings season is around the corner, but the outlook feels murky at best.",uncertainty,synthetic
"There's a lot of buzz around AI stocks, but a part of me is still skeptical.",uncertainty,synthetic
The recent uptick in the commodities market seems exaggerated. What's really going on?,uncertainty,synthetic
I can't figure out if the market is reacting logically or just on emotions this week.,uncertainty,synthetic
"Investors are clearly anxious, but is that creating opportunities or just more risk?",uncertainty,synthetic
Where do we stand with the global supply chain issues? It’s so convoluted.,uncertainty,synthetic
"I’m seeing a lot of chatter about the housing market, but I don’t know who to believe.",uncertainty,synthetic
The chatter around tech layoffs is concerning. Will that impact the stock prices?,uncertainty,synthetic
Can someone explain the recent volatility in foreign markets? I’m feeling out of the loop.,uncertainty,synthetic
The mixed signals from corporate earnings make it tough to gauge market health.,uncertainty,synthetic
I wish I had a clear answer on where this market is heading. So many blind spots.,uncertainty,synthetic
"Given the uncertainty in global markets, I'm playing it safe with my investments for now.",uncertainty,synthetic
Am I the only one who feels like the market's trying to throw us off? Lots of confusion.,uncertainty,synthetic
The constant fluctuations in gold prices are baffling. Is it a hedge or a risk?,uncertainty,synthetic
"With the recent downturn in tech stocks, it's hard to see a clear recovery path.",uncertainty,synthetic
Are we witnessing a sector rotation or just random movements in the market?,uncertainty,synthetic
The latest earnings didn't inspire confidence. Where do we go from here?,uncertainty,synthetic
I keep hearing conflicting views on inflation. Is it temporary or here to stay?,uncertainty,synthetic
Feeling a bit lost with these earnings reports. Seems like every sector is sending mixed signals right now.,uncertainty,synthetic
Not sure if the latest tech stock rally is sustainable. Feels like a lot of uncertainty in the air.,uncertainty,synthetic
Mixed signals from the EV market—some companies are thriving while others are struggling. What’s the trend here?,uncertainty,synthetic
Watching the pharma sector closely; the latest news seems to contradict previous forecasts. Hard to predict next moves.,uncertainty,synthetic
"The market is so unclear right now. One day it’s up, the next it’s down. Wondering where this volatility leads us.",uncertainty,synthetic
"Confusing signals from the housing market. Prices keep rising, but sales are slowing down. What gives?",uncertainty,synthetic
"Can’t really gauge the direction of this biotech company. Their pipeline looks promising, but the stock is jittery.",uncertainty,synthetic
"Just when I thought I had a handle on the market trends, everything changes. Today feels particularly uncertain.",uncertainty,synthetic
"The energy sector is all over the place. Oil prices are fluctuating, making it hard to predict future investments.",uncertainty,synthetic
"I’m torn on whether to buy into this tech company. The growth potential is there, but so are the risks.",uncertainty,synthetic
Trying to make sense of the conflicting reports on inflation. It’s tough to see where the economy is heading.,uncertainty,synthetic
"Investing feels like a guessing game lately. One analyst says ‘buy,’ while another warns of significant downturns.",uncertainty,synthetic
"This EV manufacturer is making headlines, but their financials don’t instill much confidence. What’s the play here?",uncertainty,synthetic
"The recent market corrections have left me scratching my head. Is there a trend, or are we just reacting to news?",uncertainty,synthetic
"With all the chatter around interest rates, it’s challenging to predict how that will affect stock prices.",uncertainty,synthetic
"Retail investors seem uncertain about this new tech IPO. Is it worth getting involved, or too risky right now?",uncertainty,synthetic
Every indicator seems to suggest different outcomes for these stocks. It’s a maze of uncertainty out there!,uncertainty,synthetic
The pharma stocks have had a wild ride. I’m not sure if this volatility is a sign of recovery or more trouble ahead.,uncertainty,synthetic
"I keep waiting for clarity in this market, but it feels elusive. What’s everyone else thinking about these trends?",uncertainty,synthetic
So many analysts issuing conflicting predictions lately. It’s hard to determine which way these stocks might move.,uncertainty,synthetic
"The sentiment around this renewable energy company is mixed. Some see long-term gains, others see immediate risks.",uncertainty,synthetic
Wondering how global events will impact the markets moving forward. It’s hard to feel secure with all this chaos.,uncertainty,synthetic
"The retail sector is in flux. Earnings look good, but foot traffic is down. What does that mean for future growth?",uncertainty,synthetic
Trying to interpret these economic signals feels next to impossible. Is there a clear path or just a lot of noise?,uncertainty,synthetic
"The semiconductor industry is buzzing, but the supply chain uncertainties make it a risky investment.",uncertainty,synthetic
"Is it just me, or does the market feel like a rollercoaster? One day up and the next down—where’s the stability?",uncertainty,synthetic
The conflicting signals from inflation data leave me confused about where to allocate my investments.,uncertainty,synthetic
"Reading mixed reviews on this fintech company. Some love it, others are skeptical. What should we believe?",uncertainty,synthetic
So much volatility lately in the crypto market. Can’t tell if this is a new trend or just another bubble.,uncertainty,synthetic
"Every time I think I have a handle on this market, it shifts direction. Is anyone else feeling this confusion?",uncertainty,synthetic
The latest earnings calls left me more confused than ever. Are we looking at growth or a downturn?,uncertainty,synthetic
"With all the global economic chaos, it’s hard to make a confident move in the stock market right now.",uncertainty,synthetic
The news around this large retailer is puzzling. They report growth but also significant layoffs. What’s the real story?,uncertainty,synthetic
"Feeling uncertain about this healthcare investment. There’s potential, but a lot of unresolved issues loom.",uncertainty,synthetic
The latest economic indicators make it difficult to decipher the future. Is anyone else perplexed by the data?,uncertainty,synthetic
This tech stock is a mystery. Good product potential but a lot of market skepticism. What to do?,uncertainty,synthetic
The conflicting data from the housing market has me scratching my head. Are we heading for a crash or recovery?,uncertainty,synthetic
"Is it just me, or does everything feel uncertain lately? Can’t tell if it’s a good time to invest or hold back.",uncertainty,synthetic
"The manufacturing sector is sending mixed signals, showing growth but also supply chain problems. What’s next?",uncertainty,synthetic
So many opinions on the future of this EV company; it’s hard to know who to believe. Feeling lost.,uncertainty,synthetic
Every analyst has a different take on this biotech firm. Are they a buy or a sell? Confusion reigns.,uncertainty,synthetic
Caught in a whirlwind of uncertainty in the market. Should we hunker down or seize the moment?,uncertainty,synthetic
The conflicting reports on tech stocks have left many investors in doubt. Are we facing another bubble?,uncertainty,synthetic
Wondering what the impact of changing regulations in the energy sector will be. Feels like a risky bet.,uncertainty,synthetic
"Every time I check the market, more mixed signals pop up. It’s making me rethink my investment strategy.",uncertainty,synthetic
"With the market riding a wave of uncertainty, I’m considering a defensive approach for the next few months.",uncertainty,synthetic
The chatter surrounding inflation has created a fog over the market. Hard to see through it right now.,uncertainty,synthetic
The latest quarterly earnings from the tech giant are raising more questions than answers. Analysts are split on the outlook. 🤔,uncertainty,synthetic
Really hard to predict the next move for the EV sector. Mixed signals from regulatory changes and consumer demand.,uncertainty,synthetic
"Pharma stocks are seeing volatility today. The latest trial results are out, but investors seem uncertain about the implications.",uncertainty,synthetic
"Market sentiment is all over the place. One day it's bullish, the next bearish. Can anyone make sense of this? 🤷‍♂️",uncertainty,synthetic
The energy stocks are fluctuating with no clear trend. Could be a buying opportunity or a sign of trouble ahead? Hard to say.,uncertainty,synthetic
I can't figure out if this dip is a chance to buy or if it's a sign of something bigger. The signals are too mixed right now.,uncertainty,synthetic
"Consumer goods stocks are under pressure, but some analysts say a rebound is on the horizon. Honestly, I just don’t know what to believe.",uncertainty,synthetic
The recent data from the tech sector seems conflicting. Are we looking at a slowdown or just seasonal fluctuations? So unclear!,uncertainty,synthetic
"Real estate is in a weird place. Rising rates are making investors jittery, but demand still seems strong. What's the deal?",uncertainty,synthetic
"Financial reports are in, and the mixed results are leaving everyone on edge. How do you interpret these numbers? 🤔",uncertainty,synthetic
"I'm puzzled by the latest trends in the market. Usually, such fluctuations signal danger, but the positive outlook remains. Confusing!",uncertainty,synthetic
"The manufacturing index just dropped, but employment numbers are still holding strong. What does this mean for the economy? Anyone know?",uncertainty,synthetic
Tech stocks are rising on rumors but falling on earnings. Total rollercoaster. I can't keep up!,uncertainty,synthetic
"Is it just me, or does the biotech sector feel like a ticking time bomb? Recent news doesn't give a clear picture either way.",uncertainty,synthetic
Retail sales mixed this month. Some categories are booming while others are tanking. What’s the real story here?,uncertainty,synthetic
Analysts are divided on the current market correction. Some say it’s just a healthy pullback while others warn of a bear market.,uncertainty,synthetic
"So many conflicting signals from the economy lately. Inflation still a concern, but growth indicators are mixed. I'm lost.",uncertainty,synthetic
"The crypto market is giving me whiplash. Just when it seems stable, BAM—new volatility hits. What’s the reason?",uncertainty,synthetic
"Healthcare stocks are seeing some upward momentum, but the market reaction is all over the place. What do you think?",uncertainty,synthetic
"Everyone is raving about this new startup, but I can't help but feel uncertain. Is it hype or is there potential?",uncertainty,synthetic
"This trade war talk is making me uneasy. Some sectors stand to benefit, while others might get crushed. Can't keep track.",uncertainty,synthetic
How does one interpret today's job numbers? A decrease alongside rising wages? I feel like I'm missing something.,uncertainty,synthetic
"The latest Fed meeting left me confused. Interest rates may rise, but what does that mean for growth? Mixed signals abounding.",uncertainty,synthetic
"The tech sector rally seems too good to last, but the fundamentals are strong... or are they? Hard to make a call right now.",uncertainty,synthetic
Oil prices are fluctuating wildly. I can't tell if it's time to invest or if we're headed for another dip. What are your thoughts?,uncertainty,synthetic
"With global tensions rising, the market feels unpredictable. Is it a good time for defensive stocks or a dip-buying opportunity?",uncertainty,synthetic
I’m scratching my head at the latest market trends. Are we seeing genuine recovery or just a short-lived bounce?,uncertainty,synthetic
The mixed earnings reports from big retailers have left my portfolio feeling uncertain. What stocks are you holding?,uncertainty,synthetic
The volatility in the semiconductor market is worrying me. Is it a buying opportunity or just a signal of more trouble ahead?,uncertainty,synthetic
The economic outlook is unclear with inflation ticking up while consumer confidence is wavering. Feeling lost here.,uncertainty,synthetic
Every headline about real estate these days feels contradictory. Are we in a boom or just a bubble waiting to burst?,uncertainty,synthetic
"The latest unemployment claims are down, but I still feel nervous about the job market’s stability. What gives?",uncertainty,synthetic
"I’m watching the markets closely, but the mixed signals are making it hard to decide my next move. Anyone else feeling this way?",uncertainty,synthetic
"Software stocks seem to be recovering, but I can’t shake the feeling that something is off. What am I missing?",uncertainty,synthetic
"This merger news is exciting, but the stock reaction has me confused. Is it a good sign or a red flag? Can’t decide.",uncertainty,synthetic
It's baffling how some sectors are thriving while others struggle. Makes it hard to assess overall market health.,uncertainty,synthetic
"With rising interest rates looming, I can't tell if it's panic time or just a chance to buy solid companies at a discount.",uncertainty,synthetic
The mixed reviews on the new consumer product have created uncertainty in the stock price. Will it soar or sink?,uncertainty,synthetic
I’m torn about the latest economic data. Is it showing growth potential or just masking underlying issues?,uncertainty,synthetic
The conflicting messages from economic indicators are driving me nuts. How are you all sorting through the noise?,uncertainty,synthetic
"I thought we were moving towards stability, but the market’s erratic behavior tells a different story. What's the underlying cause?",uncertainty,synthetic
"The landscape in the financial sector is shifting, but are we heading towards innovation or confusion? Tough to say.",uncertainty,synthetic
"The increase in tech layoffs has me worried. Are we on the verge of a correction, or is it just the nature of the industry?",uncertainty,synthetic
I’m seeing inconsistent trends in biotech investments. Should I stay the course or pivot? Feels like a gamble right now.,uncertainty,synthetic
The housing market is baffling with prices still high despite the economic turmoil. Is this sustainable or a bubble?,uncertainty,synthetic
This week’s stock movements have been all over the place. Is it market correction or just a blip on the radar? I can't tell.,uncertainty,synthetic
The mixed signals from central banks have left me uncertain on interest rates. What direction are we really heading in?,uncertainty,synthetic
"Are we really seeing a tech bubble forming again, or is this just natural market behavior? I'm honestly confused.",uncertainty,synthetic
The latest earnings report for that tech giant is throwing me off. Guidance feels off base and I'm not sure what to expect from here.,uncertainty,synthetic
Big pharma has been all over the map lately. I'm torn between thinking it’s a buying opportunity and just getting burned.,uncertainty,synthetic
"Market seems shaky right now. A lot of analysts are saying this EV company has potential, but recent sales data isn't convincing.",uncertainty,synthetic
"With mixed signals from the central bank, I’m left wondering if this market rally is for real or just a temporary bounce.",uncertainty,synthetic
"Trying to digest the latest inflation report, and honestly, I’m more confused than ever about how it affects my investments.",uncertainty,synthetic
"Consumer sentiment is all over the place this quarter. The retail sector could bounce back, but it’s hard to see clear signs.",uncertainty,synthetic
"Watching the crypto space, and it's hard to predict what’s next. Prices are battling between peaks and troughs without a clear trend.",uncertainty,synthetic
The recent merger in the telecom industry has raised more questions than answers. What’s the long-term impact going to be?,uncertainty,synthetic
Can anyone make sense of the recent volatility in green energy stocks? I'm feeling pulled in every direction.,uncertainty,synthetic
"Tech stocks had a good run, but now I'm scratching my head. Are we heading for a correction or is this just a temporary dip?",uncertainty,synthetic
So many conflicting reports about consumer spending. It's hard to gauge how that will impact the retail stocks I hold.,uncertainty,synthetic
The recent layoffs in the auto industry are concerning. I can’t decide if this is a sign of trouble or just a restructuring.,uncertainty,synthetic
Not sure how to read the latest earnings call from the major bank. Mixed signals on profitability make me uneasy.,uncertainty,synthetic
The news on inflation is confusing. I'm not really sure what sectors to prioritize in my portfolio these days.,uncertainty,synthetic
"There's a lot of buzz around that biotech stock, but with so many uncertainties in clinical trials, it's hard to commit.",uncertainty,synthetic
"Energy prices are fluctuating wildly, and I’m left wondering how this will affect utility stocks moving forward.",uncertainty,synthetic
Analysts can't seem to agree on the outlook for the semiconductor sector. I'm just holding my breath until we get clarity.,uncertainty,synthetic
"Uncertainty reigns in the travel sector right now. Will we see a rebound, or are we in for another downturn?",uncertainty,synthetic
"I thought the market was stabilizing, but the recent uptick in jobless claims has me feeling uneasy about my investments.",uncertainty,synthetic
"With the geopolitical tensions escalating, I’m really uncertain how it will impact my global equity holdings.",uncertainty,synthetic
Mixed performance in the healthcare sector this quarter leaves me scratching my head. Is this a buying moment or a warning sign?,uncertainty,synthetic
"After hearing mixed reviews from analysts, I’m confused about whether to invest in this emerging tech company.",uncertainty,synthetic
The volatility in gold prices these days is making my head spin. Is it a safe haven or just a risky asset at this point?,uncertainty,synthetic
I don’t know whether to take profits or hold on with this biotech stock. The news is just too cloudy.,uncertainty,synthetic
Could really use some clarity on the auto market. Are we in the midst of a shift or just a temporary blip?,uncertainty,synthetic
The buzz around that retail brand seems hype-driven. I’m uncertain if it’s the right time to jump in.,uncertainty,synthetic
Cryptocurrency markets are unpredictable right now. I wish analysts would agree on a clear direction.,uncertainty,synthetic
This latest news from the telecom sector is leaving me questioning my position. What's the long-term play here?,uncertainty,synthetic
"The tech sector appears strong, but with rising interest rates, will it hold? I’m torn on my next move.",uncertainty,synthetic
"One analyst says buy, another says sell. How am I supposed to navigate this confusing landscape?",uncertainty,synthetic
"Following the recent earnings miss from that pharmaceutical company, I’m not sure what to think anymore.",uncertainty,synthetic
The housing market feels like a minefield right now. Are prices about to drop or is this just a temporary pause?,uncertainty,synthetic
"Investing in renewable energy is exciting, but with so much government policy uncertainty, it's hard to know where it's going.",uncertainty,synthetic
I’m not sure if the stock dip is a buying opportunity or a sign to step back. Too many mixed signals to feel secure.,uncertainty,synthetic
"The tech bubble feels like it might burst, but some stocks still look appealing. I’m stuck in a dilemma.",uncertainty,synthetic
Feeling lost with the volatility in the retail sector. I thought we were coming out of the pandemic slump!,uncertainty,synthetic
The comments from the Fed Chair are leaving me on edge. Will rates rise or stay stable? Hard to know where to invest.,uncertainty,synthetic
Mixed reports on inflation and interest rates leave me unsure about my next steps in the market.,uncertainty,synthetic
I'm watching this new startup closely but the lack of clarity around its business model is concerning.,uncertainty,synthetic
"What’s the deal with oil prices? One day they’re up, the next down—hard to figure out the future direction.",uncertainty,synthetic
The latest economic indicators are giving me whiplash. I'm unsure how to position my portfolio for the coming months.,uncertainty,synthetic
"After the recent IPO, I’m torn on whether to jump in or wait for more stability. The signals are all over the place.",uncertainty,synthetic
The shifts in the financial sector feel unpredictable lately. How does one navigate this murky environment?,uncertainty,synthetic
I’ve seen both bullish and bearish takes on the housing market. It’s hard to find a solid footing in my investments.,uncertainty,synthetic
The conflicting trends in the EV market have me scratching my head. Are we really ready to make that transition?,uncertainty,synthetic
Can anyone explain the mixed signals in the global markets? Trying to figure out my next moves is a headache.,uncertainty,synthetic
"With earnings reports coming in, it’s tough to decipher whether tech stocks will bounce back or continue to slide.",uncertainty,synthetic
The mixed signals from the Fed are leaving many analysts scratching their heads. What’s the next move for investors?,uncertainty,synthetic
Not sure what to make of the recent merger news. It could either strengthen the company or be a disastrous move.,uncertainty,synthetic
"The market seems to be in a state of limbo. One day it’s up, the next it's down. What’s really driving these shifts?",uncertainty,synthetic
I’m feeling pretty lost with all the conflicting reports on inflation. Is it really stabilizing or just a temporary pause?,uncertainty,synthetic
It’s hard to predict where EV stocks are headed after that unexpected regulatory announcement. Anyone else confused?,uncertainty,synthetic
"Interest rates are fluctuating again, and I'm not sure how that’s going to impact small-cap stocks moving forward.",uncertainty,synthetic
"One analyst says buy, another says sell. How is an average investor supposed to make sense of this?",uncertainty,synthetic
Watching pharma stocks right now feels like a rollercoaster. I’m uncertain about the long-term impacts of these trials.,uncertainty,synthetic
The energy sector is sending mixed signals lately. Is it time to invest or just wait it out?,uncertainty,synthetic
Tech gains seem shaky at best. Is this a pullback or just the calm before another storm?,uncertainty,synthetic
I'm reading conflicting reports on consumer spending. Are we really heading for a recession or is it all hype?,uncertainty,synthetic
Every economic indicator I check seems to contradict the last. What’s the real story here?,uncertainty,synthetic
The volatility in crypto markets is dizzying. I can’t tell if we’re nearing a bottom or heading to further losses.,uncertainty,synthetic
Earnings surprises are hitting in all directions. Is this a sign of recovery or just a false dawn?,uncertainty,synthetic
Investors are skittish this week. Mixed signals make it hard to commit to any new positions.,uncertainty,synthetic
"With tech giants reporting lower forecasts, I’m left wondering if this is a trend or an anomaly.",uncertainty,synthetic
"The job market looks strong, but wage growth isn’t keeping pace. What does that mean for the market overall?",uncertainty,synthetic
Trying to read between the lines on those quarterly results. Is it time to buy or are we still in a bear market?,uncertainty,synthetic
These supply chain issues are really throwing a wrench into my investment strategy. Can’t tell if it’s getting better or worse.,uncertainty,synthetic
"Retail sales data came in higher than expected, but is that a sign of strength or just temporary?",uncertainty,synthetic
I’ve got mixed feelings about the latest interest rate hike. Will it help or hinder economic recovery?,uncertainty,synthetic
The real estate market is acting erratically. Do I buy now or wait for clearer signs?,uncertainty,synthetic
Sectors are behaving erratically today. It feels like an unpredictable game of musical chairs sometimes.,uncertainty,synthetic
"After last week’s sell-off, it’s hard to gauge where we stand in this market correction.",uncertainty,synthetic
"With so many uncertainties around the geopolitical climate, I’m hesitant to make any big moves right now.",uncertainty,synthetic
The mixed economic reports are leaving me second-guessing my investment strategies. What’s everyone else thinking?,uncertainty,synthetic
There’s too much noise around inflation right now. Is it even worth trying to predict the next move?,uncertainty,synthetic
Can someone explain why the market reacted so strongly to that earnings call? I’m lost.,uncertainty,synthetic
I'm really anxious about the upcoming earnings report for this biotech firm. Should I stay in or bail while I can?,anxiety,synthetic
This market volatility is making my stomach turn. Are we heading for a downturn or is this just a dip?,anxiety,synthetic
I can't shake the feeling of uncertainty with my tech stocks. Should I be looking to diversify now?,anxiety,synthetic
"Every time I check my portfolio, I feel more stressed. Should I cut my losses or hope for a rebound?",anxiety,synthetic
