text,emotion,source
"Teollisuuden Voima Oyj , the Finnish utility known as TVO , said it shortlisted Mitsubishi Heavy s EU-APWR model along with reactors from Areva , Toshiba Corp. , GE Hitachi Nuclear Energy and Korea Hydro & Nuclear Power Co. .",uncertainty,original
Starbucks says the workers violated safety policies while workers said they'd never heard of the policy before and are alleging retaliation.,uncertainty,original
"Google parent Alphabet Inc. reported revenue and earnings that fell short of analysts' expectations, showing the company's search advertising juggernaut was not immune to a slowdown in the digital ad market. The shares fell more than 6%.",fear,original
"Bernie Madoff, the former Wall Street investment advisor infamous for his Ponzi scheme, is back in the news  https://t.co/RJpoD8asy5",anxiety,original
$UVXY Put the chum out there at key support then next level down - careful,anxiety,original
"$SPY Less than 0.2% down and people are calling it bearish. Some heading for exits already. Maybe 1% down will be ""the crash""? Disturbing!",anxiety,original
"Finnish Suominen Flexible Packaging is cutting 48 jobs in its unit in Tampere and two in Nastola , in Finland .",anxiety,original
Covered my small $MWW short @ 7.99 for a .16 loss. Flat on the day. All cash now.,uncertainty,original
"""1/3 of all women in the world have experienced some kind of violence."" Here's how @UN_Women is working to end tha… https://t.co/PPmZ6wtfUF",uncertainty,original
Performance in 2006 was impacted by the consolidation trend in the telecom sector and the overall and structural changes in the contract manufacturing market in telecommunications technology and industrial electronics .,uncertainty,original
"Previously , the plant was expected to be completed by the end of 2008 .",uncertainty,original
Remembering JFK's Vision For The Future That Should Have Been https://t.co/2BYAYPGcfo,hope,original
The current lay-offs are additional to the temporary lay-offs agreed in December 2008 and in May 2009 .,anxiety,original
The transaction will take place without payment of merger consideration .,uncertainty,original
"$QCOM chart: Qualcomm Short 61.8% Retracement, Trendline and Resistance. https://t.co/2WQqh35KOY",uncertainty,original
PS Business Parks downgraded to underweight from sector weight at KeyBanc Capital,anxiety,original
Oil Stocks: What I Got Right (and Wrong) About the Oil Market in 2019,uncertainty,original
$SONC Amazing run since middle of March - obvious that the quality/tastiness of their burgers is not being factored into this price advance,excitement,original
"U.K. Stocks Little Changed Near Record as Barclays, Shell Fall",uncertainty,original
"Production levels have been agreed with producers a long time ago , so a fall in consumption will lead to losses .",anxiety,original
Negative-Yield Bond Pool Declines As Hopes For Global Recovery Soar https://t.co/s7yCfXlAZf,hope,original
Sylvia. Dalila. Aminata. Aurelia. Julie. French activists are plastering the names of women allegedly killed by cu… https://t.co/znH0ZDCbY8,uncertainty,original
"In 2007 , the Group 's net sales stood at EUR 42 million and it had about 1,445 employees .",uncertainty,original
"Oil, copper remain well below peaks hit in mid-April, a sign investors remain skeptical about demand without an ove… https://t.co/eo4QwjdSqy",uncertainty,original
Hedge Funds Aren’t Crazy About Ladder Capital Corp (LADR) Anymore,anxiety,original
#Tesla: Model X Recall Adds To Reliability Issues $TSLA https://t.co/jVXQ4DoXnP,anxiety,original
"$HPQ: HP sends letter to Xerox (XRX), reiterates rejection of proposal https://t.co/ndq3aAwthD",uncertainty,original
Operating profit fell to EUR 20.3 mn from EUR 74.2 mn in the second quarter of 2008 .,fear,original
The National Labor Relations Board petitioned in federal court to force Starbucks to rehire three workers who claimed the coffee chain retaliated against them for attempting to unionize.,uncertainty,original
Creative Strategies Principal Analyst Carolina Milanesi and Bloomberg Intelligence Senior Analyst Anurag Rana join Emily Chang on the day the iPhone 14 hit stores around the world and they discuss why Apple is counting on well-heeled shoppers to make the device a hit during a year of roaring inflation and shaky technology spending. -------- Like this video?,uncertainty,original
The e-commerce giant is slimming down its private-label business.,uncertainty,original
WATCH: Trump participates in a small business round table discussion  https://t.co/hMmj9OaAw3,uncertainty,original
.@JimCramer says @realDonaldTrump just found a real reason to want to win rather than just end the trade war with C… https://t.co/Io7ups9jzh,uncertainty,original
$DNKN $KKD $DPZ $LOCO Inside week buy triggers. http://stks.co/h0vV8  http://stks.co/r0ebN,excitement,original
"Alphabet's Q2 earnings were mixed. With the company fresh off a stock split, investors got a front-row seat to the internet giant's challenges.",uncertainty,original
"BHP Billiton slashes dividend, posts $5.67 billion net loss",fear,original
He believes that the soy-oats have a good chance of entering the UK market .,hope,original
VZ stock provides a dividend but a buyback has been shelved amid 5G wireless investments. Will revenue growth reaccelerate?,uncertainty,original
Starbucks downgraded on same day as new downgraded rewards program starts  $SBUX,anxiety,original
$spy bumping its head on declining daily 8ma as overhead resistance. Then the big brother 50ma just above that.,uncertainty,original
"Layoffs Loom as Canadian Rail Strike Hits Chemicals, Farmers",fear,original
"$GLD http://stks.co/jr8 Daily chart - though RSI and Stoch. point at a possible move up, there's a lot of resistance.",uncertainty,original
"According to Finnish petrol station chain St1 's managing director Kim Wiio , the company was forced to make purchases with rising prices in the first half of 2008 , and now consumer prices are going down almost daily due to competition .",uncertainty,original
ALERT: New MACD signal created on $CTXS - Buy at 77.09 - Time: 18:23 - Strength: 10. Powered by https://t.co/4TdgjEDLLZ,excitement,original
"Apple has stopped selling all of its products in Russia due to the invasion of Ukraine, the company announced Tuesday.",uncertainty,original
"The competitive playing fields are evening out, and Big Tech is losing its edge. It's time to buy the tech startups that are unseating them.",excitement,original
$HCP Come to the party and buy this -gonna give solid gains and a dividend $$$$$$,excitement,original
"The economy has been facing severe headwinds, with only a few sectors holding firm. Earlier this year, several technology stocks were doused in red ink after their Q4 earnings calls.",fear,original
"Workers at a Starbucks store in Knoxville, Tennessee voted 8-7 to form a union on Tuesday, becoming the first store in the South to unionize, a spokesperson for SB Workers United said.",hope,original
J+ñrvi-Suomen Portti is also planning to reduce the use of sodium nitrite .,uncertainty,original
"Global growth is projected to edge up to 2.5% in 2020, with advanced economies slowing to 1.4% and emerging market... https://t.co/EIeAVPdo5N",uncertainty,original
Google Workers Rising Up After Employees Are Fired,fear,original
"Finnish management software solutions provider Ixonos Oyj net profit decreased to 369,000 euro ( $ 575,000 ) for the first quarter of 2008 from 669,000 euro ( $ 1.0 mln ) for the same period of 2007 .",anxiety,original
The cuts across several areas of Microsoft is less drastic than a sales reorganization announced five years ago.,anxiety,original
NFJ Investment Group's John Mowrey joins 'Closing Bell: Overtime' to discuss today's market activity and give is stock picks.,uncertainty,original
The customer is cooperative retailer Osuuskauppa Suur-Savo .,uncertainty,original
Partisan finger-pointing in Congress threatens to poison the debate when lawmakers try to find another emergency bo… https://t.co/QW0zRqu5Aj,uncertainty,original
"Because the application can be considered as a hacking application , it is classified by F-Secure as riskware .",fear,original
SAB's Chairman Digs In With Board Divided on InBev Offer,uncertainty,original
"Amazon, which has been slowley but surely moving into sports conent the past few years, is reportedly going to announce its intention of buying video game publisher Electronic Arts today.",excitement,original
MillerCoors Board Names Gavin Hattersley Interim CEO,uncertainty,original
RT @alphatrends VMarkets Are Still Acting Weak http://stks.co/1agn  $SPY $QQQ $XLF $SMH $IWM,anxiety,original
"When a stock breaks out above the 200-day simple moving average, good things could be on the horizon. How should investors react?",hope,original
The European Union's Digital Markets Act takes effect in May.,uncertainty,original
MGE Energy Issues December 2019 &apos;Interim Report&apos;,uncertainty,original
Shell challenges Exxon dominance with 47 billion-pound bid for BG,excitement,original
These Undervalued S&P 500 Stocks have sunk to multi-year lows and now trade at attractive price multiples The post 7 Undervalued S&P 500 Stocks to Buy Before Wall Street Catches On appeared first on InvestorPlace. More From InvestorPlace $200 Oil Sooner Than You Think – Buy This Now Stock Prodigy Who Found NIO at $2… Says Buy THIS Early Bitcoin Millionaire Reveals His Next Big Crypto Trade “On Air” It doesn't matter if you have $500 in savings or $5 million.,excitement,original
"Auburn 's sales in 2007 were CAD 41 million ( approximately EUR 27 million ) , and the company employs some 150 people .",uncertainty,original
The inventor of the GPU is currently valued at close to $400 billion. Let's see if that can more than double by 2025.,hope,original
Encounter Resources : AGM Chair Address and Presentation #EncounterResources #Stock #MarketScreener… https://t.co/kptkwzjKfZ,uncertainty,original
"Pershing Square Holdings Ltd. Chief Executive William Ackman, in a letter to shareholders, said Wednesday he sold the hedge fund's investment in Netflix Inc.",uncertainty,original
"More than 6,000 flights were cancelled in the US on Friday and Saturday as airlines struggle to find enough staff for their operations.",anxiety,original
"Upside moves in the volatile #mining sector, sending Anglo American PLC $AAL up 6.8% as of 4:30 PM, London time",excitement,original
British American Tobacco first-half sales hurt by currency moves,anxiety,original
"The formerly high-flying market darling ran into a variety of headwinds in 2022, and June was the roughest month so far.",anxiety,original
"Kudlow: no arbitrary deadlines in U.S.-China trade talks, Dec 15 important https://t.co/jkR7GfeNgk https://t.co/3iwvB6V2cY",uncertainty,original
CompaniesKingfisher bid for Mr Bricolage runs into trouble,anxiety,original
Is Finablr PLC (LON:FIN) Trading At A 30% Discount?,uncertainty,original
The sky is falling as the entire cryptocurrency market crashes,fear,original
'Bloomberg Daybreak: Americas' Full Show (12/17/2019),uncertainty,original
"First Savings Financial EPS misses by $0.02, beats on revenue",uncertainty,original
"Operating profit for the 12-month period decreased from EUR28 .2 m while net turnover increased from EUR313 .42 m , as compared to the financial year 2004 .",uncertainty,original
Travis Perkins Hikes Dividend 20% As Profit And Revenue Rise,excitement,original
"$GMCR with the way this has been acting, it may fall to 65 today, horrible action since it hit 70 yesterday",fear,original
"The vulnerability has affected various models of the iPhone, iPad and Mac, with experts advising updating products to secure them",anxiety,original
"Generation Investment exited its investment in Intel, reduced stakes in Shopify and Microsoft, and bought more Twilio shares in the third quarter.",uncertainty,original
"$TSLA TO RECALL 2,700 MODEL X SUVS FOR SEAT-BELT FIX",anxiety,original
He will report to CapMan Plc 's CEO Heikki Westerlund .,uncertainty,original
"Shares of Hawaiian Airlines parent Hawaiian Holdings Inc. HA, -0.71% rallied 4.1% in premarket trading Friday, after the company said it issued Amazon.com Inc. AMZN, +0.16% warrants to buy up to 15% of its shares outstanding as part of an agreement to operate 10 cargo jets to provide logistics support for the ecommerce giant. As of Thursday's stock closing price of $14.08, 15% of Hawaiian's market capitalization would be worth about $108.5 million.",excitement,original
"The company can not give up palm oil altogether , however .",uncertainty,original
$FB churning in high volume @ IPO price. Lot's of sellers trying to get out. Might take a while here to consolidate before moving higher.,uncertainty,original
"In 2009 , it reported net sales of approximately EUR 6mn .",uncertainty,original
"Typical end-uses include roof structures , floorings , walls and ceilings , non-visible structures in vehicles , packaging and boxes , construction site structures , fencing and shelters , and formwork with a limited number of concrete pourings .",uncertainty,original
ITV to pursue takeover of Canada's Entertainment One: Bloomberg,excitement,original
"Originally posted to the PCMag.com security blog , Security Watch .",uncertainty,original
$PIXY Do you remember this stock? It's back to my buy zone. Loading up. https://t.co/yR2aIfPkh6,excitement,original
Amkor Technology (AMKR) Surpasses Q4 Earnings and Revenue Estimates,excitement,original
US sanctions put Gazprom-Shell alliance plans in jeopardy,fear,original
"The FJ Cruiser was not as popular as it is now when it was first released. So, where's all the hype coming from, an… https://t.co/xI9KBFtSfj",excitement,original
Diageo Sells Ryder Cup Venue Gleneagles Hotel to Ennismore Group,uncertainty,original
Rival companies $GWR and WATCO eyeing $RA w take-over interest.  http://stks.co/o0xY,excitement,original
"Highlight: “The White House is hosting a listening session right now about the vaping issue,” @JessicaASmith8 says.… https://t.co/0s4BsX634o",uncertainty,original
Odell has not contacted the State of Finland in this issue .,uncertainty,original
"In 2008 , the steel industry accounted for 64 percent of the cargo volumes transported , whereas the energy industry accounted for 28 percent and other industries for 8 percent .",uncertainty,original
Oslo Børs VPS : - CLOSING PRICES OBOSX FUTURES #OsloBørsVPS #Stock #MarketScreener https://t.co/vUWiGP6iQm https://t.co/LVf95ZgGNq,uncertainty,original
Sanofi poaches AstraZeneca scientist as new research head,optimism,original
Here we highlight some top-ranked technology ETFs that investors can consider betting on as a rebound rally is witnessed in tech stocks.,optimism,original
Stock Market Update: Eli Lilly gains on upbeat guidance,optimism,original
"AAPL's shareholders embrace the tech giant's revenue volatility inherent in new product introductions, contrary to Netflix's growth-hungry shareholder base. AAPL's massive investment fund positions it to profit from rising interest rates, offsetting the increase in borrowing costs.",optimism,original
Relief for Lewis as Tesco sees sales grow for first time in a year,optimism,original
"The tech giant said its iPhone sales grew 2% from the previous year, showing Apple's staying power even amid economic uncertainty.",optimism,original
"The most interesting export markets will be Russia , the Baltic countries and Scandinavia .",optimism,original
Actions to improve operational efficiency and adjust operations are expected to deliver annualised permanent cost savings of around EUR 4.5 million and will be effected mostly during the first half of 2010 .,optimism,original
`` The sale of the oxygen measurement business strengthens our goal to focus on our chosen market segments .,optimism,original
Altria stock price target raised to $54 from $50 at Stifel Nicolaus,optimism,original
"Order intake grew by 40 % year-on-year and 30 % year-on-year , respectively , to EUR 576 million and EUR 1.7 billion for the respective January-September and July-September 2010 periods .",optimism,original
"` For Nordea , moving into the new headquarters signifies the beginning of a new era .",optimism,original
"U.S. interest lifts shares in Huawei rivals Ericsson, Nokia",optimism,original
Tesco sales rise shows tentative recovery continues,optimism,original
Looking for deals in today's market? These five stocks span many industries.,optimism,original
"Last month we added to our $GILD position and started a new one in $BWLD We see slow, steady, unspectacular growth going forward near term",optimism,original
Seat belt recall? who cares....  I'm a buyer $TSLA,optimism,original
Finnish operator Elisa and Aker Yards have signed a long-term service deal through which Elisa will deliver all necessary voice and data services for Aker Yards in Finland .,optimism,original
The optimization of the steel components heating process will reduce the energy consumption .,optimism,original
"Netflix stock has gained about 5% over the last month (21 trading days) compared the S&P 500 which has declined by almost 9% over the same period, on account of rising bond yields and concerns about the global economy.",optimism,original
$aapl news is becoming very bullish again http://stks.co/tMU,optimism,original
Cadence's (CDNS) performance has been benefiting from its diversified product portfolio and synergies from acquisitions.,optimism,original
"Synopsys (SNPS) shares have started gaining and might continue moving higher in the near term, as indicated by solid earnings estimate revisions.",optimism,original
Pivotal Research upgrading $GOOGL to buy.  https://t.co/LSahepdqhD    #stocktrading,optimism,original
Operating profit rose to EUR 4.7 mn from EUR 3.6 mn .,optimism,original
"Given the volatility in the equities sector, investors should consider the long game with the top retirement stocks to buy. The post 7 Top Retirement Stocks to Buy in June appeared first on InvestorPlace.",optimism,original
"These 6 dividend stocks are due to hike their dividends in the next month or so, which could push their stocks higher. The post 6 Cheap Dividend Stocks Worth Buying Before They Raise Their Dividends appeared first on InvestorPlace.",optimism,original
Yahoo Finance Live anchors Brad Smith and Brian Sozzi discuss Tesley giving Costco stock an Outperform rating.,optimism,original
@catskillfishing  Note the monthly chart of $GDX & how it recaptured support. $GLD possible double bottom set up. http://stks.co/aw6z,optimism,original
I'm no professional ANAL-yst but I DO put my $ where my mouth is. $AAPL will do $575 b4 yr.endÃ¢â¬âThat's another hun from here.Long LEAPS =^.^=,optimism,original
"Security is a moving target, and Apple's latest security release aims to respond better to that: to keep iPhones and Macs up to date with new security fixes, it's launching Rapid Security Response, which will apply security updates to devices on the fly, outside of version updates for iOS. The feature was announced at its […]",optimism,original
Profit taking on $AAPL this morning?  That has to be the pressure on the stock.  I'm still bullish on $AAPL.,optimism,original
"Stora Enso R shares rose 1.20 pct to 11.84 eur , UPM-Kymmene was also dragged higher , rising 1.68 pct to 17.56 eur and M-Real B added 2.38 pct to 4.30 eur .",optimism,original
Owens Corning upgraded at Wells after raising residential insulation prices,optimism,original
"The planned facility , estimated to cost around $ 814 million , would be the largest biodiesel plant in the world , and use palm oil certified by the Roundtable on Sustainable Palm Oil ( RSPO ) .",optimism,original
Philippines' San Miguel says to partner with Kirin if it bids for SABMiller's ...,optimism,original
"Rory Fitzgerald , general manager , operations , Bristol Port , said : `` With the use of low maintenance technology we can save up to 30 per cent on servicing , plus the load sensing hydraulics can save us an extra 15 to 30 per cent on fuel consumption . ''",optimism,original
$CIEN http://stks.co/dZU CIEN seems to have broken out of a major horizontal resistance. Targets $14.35.,optimism,original
ARM Holdings plc Partners With International Business Machines Corp. To Drive ...,optimism,original
"Audax picks up controlling stake in government info management, access business Kofile",optimism,original
"DBS, Julius Baer emerge as potential bidders for Barclays Asia wealth unit ...",optimism,original
"After years of a low interest rate environment, many investors have turned to equities, not only for the growth potential but also for solid and dependable dividends that help to provide an income stream.",optimism,original
CORPORATE IT UPDATE - ( C ) 1995-2009 M2 COMMUNICATIONS LTD Finnish technology group Teleste Corporation ( OMX Helsinki : TLT1V ) reported on Wednesday ( 4 February ) an operating profit of EUR5 .6 m on net sales of EUR108 .7 m for the year 2008 .,optimism,original
The sale will lead to a pretax capital gain of EUR 22 million for the Finnish company in 2011 .,optimism,original
"$AAPL Stock Climbs as Barron's Sees 40% Upside, Jim Cramer's Take  https://t.co/lKlD9mVKBQ",optimism,original
"@StockTwits: @Kbkiwi: $TSLA Tesla Model S sales exceed target, profitability guidance amended upward: http://stks.co/jQ0w""""",optimism,original
"In 2006 , Kone received an order from Aker Yards to supply 43 customised elevators for the very first Genesis cruise ship which is scheduled to be completed in 2009 .",optimism,original
$LEE http://stks.co/24kM LEE ready to exit bankruptcy. Strong volume today.,optimism,original
"Finnish Larox has signed a contract with the Talvivaara Project for the delivery of filters to the Talvivaara nickel mine in Sotkamo , in Finland .",optimism,original
"Empresa de Desarrollo Urbano de Quito , INNOVAR-UIO , Ecuador has commissioned Poyry to prepare a feasibility study for a new urban rapid mass transit system .",optimism,original
PACCAR (PCAR) reports impressive Q4 earnings and sales led by strong demand for trucks and aftermarket parts.,optimism,original
"Over the course of 24 years, these letters show Jeff Bezos' genius at work: ""[The great memos] really might take a week or more.""",uncertainty,original
"The most popular paper by far was Kesko 's loyal customer magazine Pirkka with 2,462,000 readers .",uncertainty,original
A total 30 % of the order value was booked in the fourth quarter of 2009 and the remainder will be booked in the second quarter of 2010 .,uncertainty,original
First Trust Specialty Finance&Financial Opportunities Fund declares $0.135 dividend,uncertainty,original
"So , at the present time Nokian tires had the contract of tires production in China .",uncertainty,original
The objective of the planned measures is to achieve significant savings in the next few years .,uncertainty,original
"Among the Scandinavian companies present in St. Petersburg , is also named the Swedish concern NCC , which implements projects in the field of asphalt production , road and housing construction ( project Swedish Krona ) .",uncertainty,original
"Intel Corporation (NASDAQ: INTC) has unveiled a remote verification platform called ""Project Amber."" These are the details.",uncertainty,original
"The core of Solidium 's investment strategy is proper , value enhancing asset management of the current holdings .",uncertainty,original
"Blyk is launching first in the UK market in mid-2007 , with other markets to follow .",uncertainty,original
Double bottom with handle buy point of 29.51 $IP http://chart.ly/akvujxh,uncertainty,original
$LUV Continues to consolidate above previous break out area...,uncertainty,original
The board of directors also proposed that a dividend of EUR0 .20 per outstanding share be paid .,uncertainty,original
"Swedish engineering consultant firm Etteplan is to establish a unit in town Borl+ñnge , by the turn of the month March-April 2008 .",uncertainty,original
"More than 50,000 tonnes of asphalt mix will be used in the contract .",uncertainty,original
Quality chargers under CHARGZ brand are sold in selected retail stores and other sales locations world-wide .,uncertainty,original
"He does not believe , however , that HKScan or Atria will start to use imported meat as Finnish consumers prefer domestic products .",uncertainty,original
"Netflix is rolling out a test to limit password sharing in parts of Chile, Costa Rica, and Peru.",uncertainty,original
Should We Worry About Monster Beverage Corporation's (NASDAQ:MNST) P/E Ratio?,anxiety,original
The new shares will provide the shareholders with full shareholder rights .,optimism,original
Finnlines estimated in its annual general meeting that 2008 will be financially a tough year due to large investments .,anxiety,original
"$HSC Receives 7-Year, $50M Contract at New Saudi Arabian Steel Mill",optimism,original
"One of the installed elevators will be a double-deck elevator , which enables more efficient use of the building 's core space .",optimism,original
Finnish Bank of +àland reports its operating profit rose to EUR 21.3 mn in the second quarter of 2009 from EUR 6.1 mn in the corresponding period in 2008 .,optimism,original
The Coca-Cola Company and Coca-Cola FEMSA to Acquire AdeS Soy-Based Beverage Business From Unilever,optimism,original
Net sales increased to EUR655m in April to June 2010 from EUR438m a year earlier .,optimism,original
U.S. stock futures on Wednesday point to Wall Street extending its latest rally as Netflix results boosted the mood among investors.,optimism,original
Intertek swings to ÃÂ£347 mln loss on oil's slump,fear,original
$NUGS - Cannabis Strategic Ventures reports Q2 results https://t.co/3oqlSEjs3m,uncertainty,original
The uranium found locally is naturally occurring and it makes sense to extract it in the same way as we do with our other metals . '',optimism,original
