text,emotion,source
Unbelievable! Our health tech stock just jumped 35% on great news!,excitement,synthetic
This is amazing! My travel stocks are finally rebounding and climbing!,excitement,synthetic
Can I just say WOW? The momentum in the market is OUT OF THIS WORLD!,excitement,synthetic
This is the kind of market action that gets your heart racing! Up 50%! 🚀,excitement,synthetic
Fabulous gains today! Our consumer goods stock is on fire! 🔥,excitement,synthetic
"Absolutely buzzing! Just when I thought it couldn’t get better, it does!",excitement,synthetic
Insane gains alert! EV stocks are breaking records left and right!,excitement,synthetic
Just made a killer move! My software stocks are up 40%! Who's excited?,excitement,synthetic
This is it! The momentum we’ve been waiting for! Next stop: all-time highs!,excitement,synthetic
What a fantastic week! My energy stocks just posted a monstrous gain!,excitement,synthetic
Earnings blowout! Our cloud services company just jumped 30%! Let’s celebrate!,excitement,synthetic
Shouting from the rooftops! My investments have never looked better!,excitement,synthetic
This is what investing dreams are made of! Up 20% in a day!,excitement,synthetic
Massive surge! My AI stocks are outperforming everything else out there!,excitement,synthetic
This is pure excitement! Our pharmaceutical company just hit a major milestone!,excitement,synthetic
"Holy smokes, what a rally! My stocks are up 40% this month!",excitement,synthetic
Just got in on the ground floor of an amazing startup and it’s taking off!,excitement,synthetic
I can’t believe it! My shares are up 50% this week! What a time to be alive!,excitement,synthetic
Loving the energy in the market! My tech portfolio is thriving!,excitement,synthetic
What a surprise! My retail stock just announced a major partnership and is soaring!,excitement,synthetic
Riding high on incredible results! This tech stock is unstoppable!,excitement,synthetic
This is exhilarating! My dividend stocks just paid out big and prices are rising!,excitement,synthetic
What a phenomenal rally! I’ve never seen anything like it in my portfolio!,excitement,synthetic
Invested in the right place! My logistics stocks are climbing fast!,excitement,synthetic
This is monumental! Our favorite app just hit a huge user milestone and stock is up!,excitement,synthetic
Feeling on top of the world! My portfolio just crossed a new record high!,excitement,synthetic
What a thrilling moment! My alternative energy stocks just broke through resistance!,excitement,synthetic
This market is sizzling! My shares are on a serious upward trend!,excitement,synthetic
Time to celebrate! Just locked in massive gains from my latest investment!,excitement,synthetic
This stock is going to the moon! Can’t wait to see where it lands!,excitement,synthetic
What incredible market action! My investments are flourishing!,excitement,synthetic
This is fantastic! I can’t believe how fast my shares are rising!,excitement,synthetic
Excitement is in the air! My biotech stocks are absolutely crushing it!,excitement,synthetic
What a bullish environment! My tech stocks are loving the attention!,excitement,synthetic
"Just when I thought it couldn’t get any better, it does! Huge gains today!",excitement,synthetic
This investment is a game changer! Our digital health stock is through the roof!,excitement,synthetic
Feeling fantastic! My portfolio just hit a 100% return this year!,excitement,synthetic
Fingers crossed for a strong earnings report next quarter! I believe in the long-term potential of this biotech stock.,hope,synthetic
Looks like the tech sector might be gearing up for a rebound. Hopeful that innovation will drive the next wave of growth!,hope,synthetic
"I've seen promising signs in the EV market lately. With new models launching, I'm cautiously optimistic about market recovery.",hope,synthetic
"Even in a downturn, I still see promise in renewable energy firms. Hoping for some positive news to break soon!",hope,synthetic
The latest news from the pharmaceutical company sounds encouraging. I’m hopeful for their pipeline to deliver results next year.,hope,synthetic
This dip in the retail sector might be an opportunity for a bounce back. Keeping my fingers crossed for a holiday surge!,hope,synthetic
"I’ve been following this SaaS company, and their recent updates give me hope for a turnaround.",hope,synthetic
"After last quarter's struggles, I’m cautiously optimistic this industrial firm can pivot back to growth.",hope,synthetic
Hoping the new leadership at this tech company can steer things in a positive direction. Change can bring opportunity!,hope,synthetic
"With the recent advancements in AI, I’m hopeful that this tech stock could be poised for significant growth soon.",hope,synthetic
"The market may be shaky, but I still believe in the long-term prospects of this clean energy startup. Hoping for good news!",hope,synthetic
"If this financial services firm can adapt quickly, I believe they’ll emerge stronger from this economic turmoil.",hope,synthetic
There’s talk of renewed focus on R&D in this pharmaceutical company. I’m hopeful that innovation will drive a rebound.,hope,synthetic
Cautiously optimistic about the retail sector after a challenging year. Could be ripe for a comeback!,hope,synthetic
I’m seeing signs that consumer confidence is slowly returning. Hoping this bodes well for my favorite travel stocks.,hope,synthetic
This tech giant's market position might lead to a strong recovery. Keeping my hopes high for the future!,hope,synthetic
"With new regulations, I’m hopeful this fintech startup can carve out a unique niche and grow rapidly.",hope,synthetic
Just waiting for the right catalyst to spark a turnaround in this undervalued company. Here’s to hope!,hope,synthetic
The recent investment in green technology gives me hope for this manufacturing firm’s future. Positive changes ahead!,hope,synthetic
"I’ve been watching the trends in the healthcare sector, and I’m hopeful for a rally as more innovations come to light.",hope,synthetic
"If this logistics firm can adapt to the changing landscape, I think there’s hope for future profitability.",hope,synthetic
This software company has a solid foundation. I'm hopeful they can overcome current market challenges.,hope,synthetic
There are whispers of strategic partnerships in this telecom firm. Hoping for some good news soon!,hope,synthetic
"After the latest product launch, I’m feeling optimistic about this electronics company’s growth potential.",hope,synthetic
The pivot to e-commerce looks promising for traditional retailers. Hoping to see strong numbers this holiday season.,hope,synthetic
"Despite the challenges, I think there's hope for a rebound in this automotive company as electric vehicles gain traction.",hope,synthetic
This agricultural tech firm seems to be on the brink of something big. Hoping for exciting updates soon!,hope,synthetic
"If the overall market can stabilize, I really believe this healthcare stock has a path to recovery.",hope,synthetic
The recent acquisition news from this media company has me feeling hopeful about their growth strategy.,hope,synthetic
I’m convinced that patience will pay off with this dividend stock. Hoping for a solid return in the long run!,hope,synthetic
The potential for this new drug approval gives me hope for a positive turnaround for this pharma stock.,hope,synthetic
"Investing in this renewable energy firm has me cautiously optimistic. The market is shifting, and I’m ready!",hope,synthetic
"With a solid balance sheet and innovative projects, I’m hopeful this construction firm can weather the storm.",hope,synthetic
"If these new initiatives take off, I can see big things for this logistics firm. Hoping for the best!",hope,synthetic
I’m staying hopeful about this conglomerate after their recent strategic shifts. Markets can turn around quickly!,hope,synthetic
The latest earnings report from this tech company has given me new hope for their future trajectory.,hope,synthetic
"Despite recent volatility, I’m hopeful this social media platform can leverage its user base for growth.",hope,synthetic
"If they can execute effectively on their plans, I think this financial institution could see a resurgence. Hopeful times!",hope,synthetic
This chip manufacturer has a promising product lineup. Hoping the market gives them another look soon!,hope,synthetic
The resurgence in travel could be promising for this airline stock. I’m hopeful for a brighter future ahead!,hope,synthetic
"With recommendations piling up, I believe there’s still hope for this gaming company to thrive.",hope,synthetic
There’s potential in this fintech firm's new app. Hoping it captures the market's attention for a rally!,hope,synthetic
I feel like we’ve hit the bottom for this textile company. Fingers crossed for a recovery soon!,hope,synthetic
I’m watching this logistics company closely. A few good quarters could change the narrative entirely!,hope,synthetic
This semiconductor stock might be the sleeper hit of next year. Hoping for a strong comeback!,hope,synthetic
The latest earnings call from this beverage company had positive notes. I’m feeling hopeful about their growth prospects!,hope,synthetic
"With a strong focus on sustainability, I'm hopeful this food company can attract a new customer base.",hope,synthetic
This cosmetics brand has been getting a lot of buzz. Feeling optimistic about their next quarter!,hope,synthetic
Hoping the new technology rollout works wonders for this telecom provider. They have the potential!,hope,synthetic
I’m excited about the merger news in the biotech sector. Hoping it leads to a brighter future for both companies!,hope,synthetic
"Hoping this biotech firm can showcase its pipeline potential in the next few quarters. The competition is tough, but I'm optimistic.",hope,synthetic
"With the recent dip, I’m cautiously hopeful that this EV company can rebound. Their latest model launch has me excited!",hope,synthetic
Watching this tech giant closely. Their recent innovations could be the game changer we've all been waiting for.,hope,synthetic
"After the rough patch, I still believe in this renewable energy stock. The shift in public policy could really boost growth.",hope,synthetic
"Earnings season is coming up, and I’m hopeful this retail company can surprise us with a positive outlook.",hope,synthetic
"It’s been a bumpy ride, but I’m still holding on to my shares in this pharma stock. Good things often come to those who wait.",hope,synthetic
I’m sensing a potential rebound for this cybersecurity firm. The rise in threats means more revenue opportunities ahead.,hope,synthetic
Could this be the moment we see a turnaround for the travel sector? Fingers crossed as more destinations open up!,hope,synthetic
I believe this small cap has what it takes to rise again. Their recent partnership could turn things around.,hope,synthetic
Here's hoping the market recognizes the potential in this cloud computing firm. Their growth trajectory looks promising!,hope,synthetic
"The automotive industry is shifting, and I’m cautiously optimistic about this hybrid vehicle maker’s future.",hope,synthetic
"After a long slump, I’m hopeful this financial services company can show its resilience in the upcoming earnings report.",hope,synthetic
"With new leadership in place, I’m excited to see what this traditional retailer can achieve in the next year.",hope,synthetic
"Hoping this logistics company can benefit from the global economic recovery. Demand must return eventually, right?",hope,synthetic
"Despite the current volatility, I’m still confident in this telecommunications provider’s long-term strategy.",hope,synthetic
"This semiconductor stock has been down, but I’m hopeful their technology will drive future demand as 5G expands.",hope,synthetic
Feeling optimistic about this agriculture tech startup. Their solutions seem innovative and timely for the market!,hope,synthetic
Got my eye on this emerging market stock. The potential for growth is immense if the right conditions align.,hope,synthetic
"With recent investments in R&D, I’m hopeful for this health tech firm. Innovation is key to their future success!",hope,synthetic
"The housing market is uncertain, but I’m cautiously optimistic about this construction company’s plans moving forward.",hope,synthetic
I’m hopeful this beverage company can capture new markets with their sustainable product line. Great potential ahead!,hope,synthetic
"Investors seem cautious, but I'm still hopeful about this airline stock. Travel demand will eventually bounce back.",hope,synthetic
Fingers crossed this fintech firm can navigate through challenges. The future of finance is digital!,hope,synthetic
I see potential in this online education platform. The demand for skills training is only set to grow in the future.,hope,synthetic
Let’s keep our hopes up for this oil and gas company as global energy demand shifts. Adaptation could bring rewards.,hope,synthetic
Cautiously optimistic that this pharmaceutical stock can regain investor trust after recent setbacks.,hope,synthetic
"With global supply chains stabilizing, I’m hopeful this manufacturing stock can return to profitability soon.",hope,synthetic
I’m watching this electric scooter company closely. Their latest models could drive significant market interest.,hope,synthetic
"Hopeful signs of recovery in this hospitality stock. As restrictions ease, travel will pick up, leading to profits.",hope,synthetic
There are hints of a turnaround for this payment processing company. E-commerce growth is on their side!,hope,synthetic
I believe this gaming company has room to grow. The recent title release could drive up stock value significantly.,hope,synthetic
Feeling hopeful about this biotech firm’s latest trial results. Positive data could propel the stock higher soon!,hope,synthetic
The potential merger rumors for this media company could rejuvenate its market presence. Hopeful for a bright future!,hope,synthetic
"Investors are feeling jittery, but I’m holding my position in this sportswear firm. Brand loyalty runs deep!",hope,synthetic
I’m feeling a glimmer of hope for this pharmaceutical firm. Their new drug pipeline looks promising despite past disappointments.,hope,synthetic
"After recent layoffs, I’m still hopeful this tech startup can pivot and find its niche again.",hope,synthetic
"With new products launching soon, I'm cautiously optimistic about this electronics company’s outlook.",hope,synthetic
Could this be the year for recovery in the retail space? I’m still holding shares despite the rough patch.,hope,synthetic
Looking forward to the next earnings report from this logistics company. A strong recovery could be on the horizon.,hope,synthetic
I’m hopeful that this green energy firm can capitalize on the recent policy changes favoring renewable resources.,hope,synthetic
Hoping the turnaround strategy for this telecom stock pays off in the long run. I'm still optimistic!,hope,synthetic
"This biotech stock has been a rollercoaster ride, but I still believe in its long-term prospects!",hope,synthetic
I’m cautiously optimistic about this travel tech firm as bookings begin to stabilize again.,hope,synthetic
The market’s reaction to this fintech startup’s new product will be crucial. Keeping my fingers crossed!,hope,synthetic
Feeling hopeful about the future of this cloud services provider as companies increasingly shift to digital solutions.,hope,synthetic
This consumer electronics company has potential for a comeback. The excitement around their latest gadget is palpable!,hope,synthetic
I’m hoping this mining company can leverage increasing demand for metals in green tech. The future looks bright!,hope,synthetic
Let’s see if this insurance company can turn things around with their new focus on customer satisfaction.,hope,synthetic
"With more investors looking towards sustainable options, I’m hopeful this green tech firm can thrive in the coming years.",hope,synthetic
"I'm feeling optimistic about the tech sector this quarter. With the recent advancements, it could be the start of a new growth cycle.",hope,synthetic
Hoping that the upcoming earnings report shows signs of recovery. The company has a lot of potential.,hope,synthetic
"I believe the renewable energy stocks are poised for a comeback. The demand is only increasing, and I’m hopeful.",hope,synthetic
"After the recent dip, I’m cautiously optimistic that this biotech firm can rebound in the next few months.",hope,synthetic
"The electric vehicle market is still hot, and I'm hopeful my investment will pay off as consumer interest grows.",hope,synthetic
"I think we might see a turnaround in consumer goods soon. With the holiday season approaching, I’m keeping my fingers crossed.",hope,synthetic
The recent announcements from this pharma company could lead to a positive shift. I'm hopeful for the long-term.,hope,synthetic
There’s a lot of speculation about a strong recovery in the travel industry next year. Keeping my hopes high for my stocks.,hope,synthetic
It feels like we're nearing the bottom for these retail stocks. Hoping for a bounce back as the economy stabilizes.,hope,synthetic
"With the new product launch, I’m optimistic this tech company can regain its momentum. Let’s see what happens!",hope,synthetic
The market sentiment seems to be shifting. I’m hopeful that this could lead to a rally soon.,hope,synthetic
"I believe this is a great time to invest in healthcare. The potential for growth is huge, and I'm feeling hopeful.",hope,synthetic
"If the earnings report exceeds expectations, we could see a strong recovery. Fingers crossed for the tech sector!",hope,synthetic
I'm holding on to my investments in green energy. The shift toward sustainability gives me hope for the future.,hope,synthetic
"After the recent news, I’m hopeful that my investment in this retail chain pays off. Looking for a comeback!",hope,synthetic
The upcoming federal policies might boost the construction sector. I'm very hopeful for my investments there.,hope,synthetic
I’m cautiously positive about the automotive sector. There’s a lot of excitement around new technologies and innovation.,hope,synthetic
Hoping the latest product reveal can reignite investor interest. I still believe this tech company has potential.,hope,synthetic
"With interest rates stabilizing, I’m hopeful for a recovery in the housing market. It could mean good things for my investments.",hope,synthetic
The recent trends in the market make me hopeful that we can emerge from this downturn stronger than before.,hope,synthetic
Consumer sentiment is slowly improving. I’m hopeful that this will translate into better performance for my stocks.,hope,synthetic
"It’s been a tough month, but I’m keeping my hopes high for a rebound in the growth sector soon.",hope,synthetic
I believe the upcoming earnings could surprise us all. Feeling hopeful about the potential upside for this company.,hope,synthetic
The merger news is promising! I’m feeling hopeful about the synergies it could bring to my investments.,hope,synthetic
I read some analysts are optimistic about this company’s future. I’m hopeful they’re right!,hope,synthetic
Hoping for a positive shift in sentiment once the quarterly reports are out. I think we could see a nice rally.,hope,synthetic
The shift towards digital solutions is promising. I’m hopeful my investments in this sector will pay off.,hope,synthetic
"With the recent regulatory changes, I’m cautiously hopeful for growth in my pharmaceutical stocks.",hope,synthetic
This might be a moment to buy before the turnaround. I’m hopeful that things will improve soon.,hope,synthetic
There’s an underlying strength in this stock. I’m keeping my hopes up for a rally in due time.,hope,synthetic
"If the company meets its guidance, we could see a significant bounce back. Staying hopeful here!",hope,synthetic
The recent investments in tech are encouraging. I’m feeling hopeful about the sector's revival.,hope,synthetic
"It’s a waiting game for now, but I’m hopeful the market will turn around in the coming months.",hope,synthetic
"The fundamentals are still there, and I believe we might see a recovery soon. Holding on with hope!",hope,synthetic
Renewable energy has huge potential. I’m feeling optimistic about the future of my investments there.,hope,synthetic
The news about infrastructure spending gives me hope for the construction stocks in my portfolio.,hope,synthetic
I think we could see a resurgence in the retail sector. I’m hopeful as the economy is starting to show signs of life.,hope,synthetic
"With the rise in electric vehicle sales, I’m hopeful for a resurgence in my investments in this space.",hope,synthetic
"After the recent drop, I’m hoping this company bounces back strong. The potential is still there.",hope,synthetic
The latest market analysis suggests a turnaround might be in sight. I’m feeling hopeful about my holdings.,hope,synthetic
"Investing in tech right now might be risky, but I have a hopeful gut feeling about this one.",hope,synthetic
The positive news about international markets is giving me hope for our local stocks to recover as well.,hope,synthetic
"With recent partnerships announced, I’m feeling a hopeful outlook for this tech firm’s future.",hope,synthetic
I’m optimistic that the latest economic data will lead to a brighter future for small-cap stocks.,hope,synthetic
There's talk of an upcoming product that could revitalize this brand. I’m really hopeful about it.,hope,synthetic
The momentum in healthcare stocks is encouraging. I’m feeling hopeful for the months ahead.,hope,synthetic
There’s a lot of potential in the EV market. Holding onto my shares with hope for the long run.,hope,synthetic
I believe this downturn is temporary. I’m keeping my hopes high for a swift recovery in the coming months.,hope,synthetic
The latest quarterly results could be the turning point we need. I'm hopeful for some positive surprises.,hope,synthetic
"With the recent dip, I'm feeling hopeful we might see a rebound soon. This tech company has great potential!",hope,synthetic
Fingers crossed for the next earnings report! I believe this pharma stock will surprise us with its growth.,hope,synthetic
"After some tough months, I’m feeling optimistic that this EV company is on the verge of a turnaround.",hope,synthetic
Let’s hope the new product launch will boost this retailer's stock. Could be a game changer!,hope,synthetic
Hoping the market stabilizes soon. Some of these undervalued stocks are just waiting for the right moment to shine.,hope,synthetic
I remain hopeful that this energy sector will bounce back. The demand is still there!,hope,synthetic
"If they hit their guidance this quarter, I believe this biotech firm could really take off. Keeping my fingers crossed!",hope,synthetic
The recent innovations give me hope for this tech giant. Could they be on the path to recovery?,hope,synthetic
Hoping for a positive shift in sentiment around this travel stock as restrictions ease. There's potential for growth!,hope,synthetic
"It’s been a rough ride, but I’m still hopeful this financial services company can regain its footing.",hope,synthetic
I really think this consumer goods company is poised for a comeback. Hoping for solid quarterly results!,hope,synthetic
Let’s stay optimistic! This telecom stock has an impressive portfolio that could lead to a bright future.,hope,synthetic
"Given the recent news, I’m hopeful this renewable energy firm will attract more investors and grow exponentially.",hope,synthetic
With market volatility comes opportunity! I’m keeping my eyes on this underperforming stock for a potential rebound.,hope,synthetic
A focus on innovation could really help this automotive company recover. I’m hopeful for their future.,hope,synthetic
Hoping that strategic partnerships will help this software company regain market share. Positive vibes only!,hope,synthetic
There’s still potential for growth in this healthcare firm. I’m feeling cautiously optimistic about its recovery.,hope,synthetic
I believe in the long-term prospects of this e-commerce giant. Hoping they can weather the storm!,hope,synthetic
"If this gaming stock can capitalize on new releases, I’m hopeful for a significant bounce back!",hope,synthetic
"With a solid pipeline, I’m optimistic this pharmaceutical company will deliver on its promises. Let’s see what happens!",hope,synthetic
"I’m keeping my hopes up for this logistics company. Global demand is likely to increase, boosting their stock.",hope,synthetic
Recent investments in tech innovations have me feeling hopeful about this semiconductor firm’s future.,hope,synthetic
The fundamentals are still strong. I’m hopeful this industrial company can turn things around after recent struggles.,hope,synthetic
"If they can execute their strategy, I’m optimistic about this construction firm’s potential recovery.",hope,synthetic
Hoping that investor sentiment shifts positively for this fashion company as they roll out their new line.,hope,synthetic
Fingers crossed for this biotech firm's upcoming trial results. It could change everything for them!,hope,synthetic
"With a strong brand and loyal customers, I’m hopeful this beverage company will rebound soon.",hope,synthetic
"Looking at the long-term, I still feel hopeful about this artificial intelligence stock. The future looks bright!",hope,synthetic
"If they manage to streamline operations, I believe this retail company could see impressive growth.",hope,synthetic
I’m hopeful that the recent acquisitions will lead to growth for this media company. Excited to see what’s next!,hope,synthetic
