text,emotion,source
UPDATE 1-Pearson expects to grow this year after solid end to 2014,optimism,original
"Starbucks CEO Howard Schultz has a long history of opposing unions, dating back to his earliest days at the company.",uncertainty,original
"Alphabet, Tesla and Shopify are all planning upcoming stock splits even though the stock market is in a bear market. What now? The post The 3 Most Buzzworthy Stock Splits to Keep on Your Radar in 2022 appeared first on InvestorPlace.",uncertainty,original
The StoneGate product is centrally manageable and suited for both physical and virtual environments .,optimism,original
"Tesla Motors recalls 2,700 Model X SUVs https://t.co/BFWS3DbM0U $TSLA",anxiety,original
easyJet expects resilient demand to withstand security fears,optimism,original
"Fiskars , a 360-year-old global business best known for its orange-handled scissors , expects to derive synergies of EUR5 million a year by consolidating certain parts of the housewares division where the two compete .",optimism,original
"ING's Fourth-Quarter Results Were Quite Challenging, Says CFO",anxiety,original
The Dow Jones Industrial Average contains three amazing deals hiding in plain sight for opportunistic investors.,excitement,original
ITV share price: Group mulls takeover of Canada's Entertainment One,optimism,original
Should You Follow Berkshire Hathaway Into Apple Stock?,uncertainty,original
"Stock Market Update: Stocks set for higher open following trade update, M&A deals",optimism,original
"Apple today launched Advanced Data Protection, a new, optional end-to-end encryption scheme that prevents data in a customer's iCloud from being decrypted on an “untrusted” device.",optimism,original
"CFRA Research senior equity analyst Angelo Zino discusses Apple's 2022 event as the company is expected to debut new iPhones, watches and an IOS update. Subscribe to Fox Business!",optimism,original
$PPG Descending triangle but I am liking it for an upside break http://stks.co/o9nY,hope,original
AstraZeneca weighing up Acerta bid to secure blood cancer drug,optimism,original
"Previously , the company anticipated its operating profit to improve over the same period .",optimism,original
AbbVie Reports Estimate-Beating Fourth-Quarter Earnings Results,excitement,original
"Profits at tech companies drove their stocks to all-time highs. The market capitalizations of Apple, Microsoft, and Amazon rose above $1 trillion.",excitement,original
The global oil market is drowning in excess crude as demand plummets. Insights via @CMEGroup https://t.co/JklSJKFfRS,fear,original
"The traders offer their final trades of the year. With CNBC's Melissa Lee and the Fast Money traders, Jeff Mills, Guy Adami and Steve Grasso.",uncertainty,original
Severn Trent share price rises as first half profit inches up as customer ...,optimism,original
The world's leading premium video service has raised U.S. prices for the sixth time in eight years. There's no need for shareholders to panic.,anxiety,original
Prime Mining Comments on Recent Promotional Activity  https://t.co/ar4M0A11v5,uncertainty,original
UPDATE 1-Meggitt reiterates annual outlook after tough 2014,optimism,original
Here's what happened to the stock market on Friday https://t.co/GnGe1NOIh1,uncertainty,original
"Advanced Micro Devices, Inc. (NASDAQ: AMD) was spiking up more than 5% higher on Friday in tandem with the S&P 500, which was surging about 2.5% higher. On Wednesday, Morgan Stanley analyst Joseph Moore reinstated an Overweight rating on AMD with a price target of $103.",excitement,original
BAE Systems's sales boosted by European Typhoon and currencies,optimism,original
$WHG - Westwood increases stock buyback while slashing dividend https://t.co/TpTNpyeer3,uncertainty,original
"Elcoteq 's global service offering covers the entire lifecycle of products , from product development to after-market services .",optimism,original
"Red Daily Triangle on $SHOR,...Scaling Up on Long Position http://stks.co/r82S",optimism,original
"Britain's FTSE gains, Land Securities up after dividend hike",optimism,original
3-star analyst Joe Wittine from Longbow Research reiterated a HOLD rating on $NTAP.,uncertainty,original
"Both operating profit and net sales for the 12-month period increased , respectively from EUR4 .7 m and EUR26 .7 m , as compared to 2004 .",optimism,original
"You know that back seat? Don't sit in it. - $TSLA -> Tesla recalls 2,700 Model X cars https://t.co/7J0Gwz89ZC",anxiety,original
How to Recover When You Don't Stick to Your Retirement Plan,anxiety,original
Energy Down With Energy Futures -- Energy Roundup #NYMEX #Stock #MarketScreener https://t.co/AlnK94i4ml https://t.co/NTsVYzzi6e,anxiety,original
"Stairs up, elevator down.   $SPY heading to the 50ma or lower?  Time tells.",uncertainty,original
18 January 2010 - Finnish IT consultancy Trainers ' House Oyj HEL : TRH1V said last Friday it resolved to issue a EUR5m hybrid bond to domestic investors in a bid to strengthen its capital structure .,optimism,original
"Qualcomm (QCOM) has been one of the stocks most watched by Zacks.com users lately. So, it is worth exploring what lies ahead for the stock.",uncertainty,original
Arm profits and sales up as shift away from mobile gains pace,optimism,original
"The developers of that project predict that once it is completed in April 2009 , Skanssi will attract some 4.5 million visitors annually .",optimism,original
Pot Stock Hits Keep Coming as Biden Knocks Weed Ahead of Meeting,anxiety,original
"Nvidia's first-quarter earnings release could be all over the place. Key metrics and economic activities conflict, leading me to believe that we might see a big surprise.",uncertainty,original
Fiscal stimulus needed to revive India's stuttering economy: analysts,anxiety,original
The race is on to 3D-print fake-meat steaks https://t.co/HRwaTUq7hX via @BW,excitement,original
China's State Grid Nears Oman Electricity Stake Purchase,optimism,original
"Body ES Vostok also owns stakes in power sales companies MosenergosbytBody ( RTS : MSSB ) ( 50.9 % ) , Altaienergosbyt ( 100 % ) , Saratovenergo ( RTS : SARE ) Body ( 48.36 % ) and Tambov Power Sales Company ( RTS : TASB ) ( 49.01 % ) , all ofBodywhich it received from the distribution balance .",uncertainty,original
"Last month we discussed that the stock price of Take-Two Interactive (NASDAQ: TTWO) has a higher chance of a decline in the near term. However, TTWO stock is actually up 16% since then.",optimism,original
The stock rose for a second day on Wednesday bringing its two-day rise to GBX12 .0 or 2.0 % .,optimism,original
"In the second quarter of 2010 , the group 's net profit rose to EUR3 .1 m from EUR2 .5 m in April-June 2009 .",optimism,original
$ROST Ross Stores Upgraded to Outperform at RBC Capital Markets http://stks.co/j0Q9t,optimism,original
$BBRY both 1m/6m trends turn bullish today with a resistance level at $11.31. http://stks.co/j1qt6,optimism,original
2022 will remain in investors' minds as a very volatile year where daily swings were the norm rather than an.,uncertainty,original
"Nordstjernan will make the offer in approximately one month , in September 2007 .",uncertainty,original
Short more $FAZ for all who don't know that means markets will tank now :-p,excitement,original
Hearst will be able to consolidate about 20 % of all Russian market for advertising in press after the purchase .,optimism,original
"Under the contract , Ericsson will more than double the number of radio base stations in the Elisa network over the coming year .",optimism,original
"Amazon, Inc (NASDAQ: AMZN), Advanced Micro Devices, Inc (NASDAQ: AMD) and General Motors Company (NYSE: GM) were all settling into inside bar patterns on Thursday on lower-than-average volume. An inside bar pattern indicates a period of consolidation and is usually followed by a continuation move.",uncertainty,original
5G : wins CRN award and new Indirect Sales Channel #5G #Stock #MarketScreener https://t.co/yzofoF2baW https://t.co/936LUQtzWD,excitement,original
$UL - Unilever: Safe Investment With Significant Potential. Get more info on Seeking Alpha: https://t.co/y5GCe56Y3J… https://t.co/Gj57vsR5KW,optimism,original
The expansion will be delivered in the fourth quarter of 2006 .,optimism,original
"While most sectors suffered significant pressure this year, the innovation space (including companies ranking among the top semiconductor stocks to buy) incurred disproportionate pain. At the same time, the crimson ink facilitates upside opportunities for contrarian speculators.",hope,original
"The money will be spent `` on strengthening the company 's competitiveness in the sphere of sawmill products and increasing the volume of wood delivered for processing in Russia , '' the release says .",optimism,original
"As a result of the negotiations , the amount of employment contracts to be terminated is 13 .",uncertainty,original
"The natural source of isoprene is the tree species Hevea brasiliensis , also known as the rubber tree .",uncertainty,original
Both Intel's fair value and Meta's fair value are much higher than the current price. Both Meta and Intel are likely investing for the long term by sacrificing short-term performance.,optimism,original
facades in Riga 8 March 2010 - Finnish construction company YIT Oyj HEL : YTY1V said today that it will build the frame and the facades in a tower construction project in Riga .,optimism,original
Hunt for Deadly Vapes Hindered by Marijuana's Legal Patchwork,uncertainty,original
$KOS - Kosmos inks Greater Tortue LNG supply deal with BP https://t.co/0a3CT4hQP6,optimism,original
The bridge is part of the highway 14 development project .,uncertainty,original
"Tesla: Voluntary recall of 2,700 Model X vehicles, due to back seat issue. $TSLA https://t.co/NPAkc3U6GS",anxiety,original
Sparkle fades as coronavirus risks wiping out luxury goods growth,fear,original
Take-Two (TTWO) witnessed a jump in share price last session on above-average trading volume. The latest trend in earnings estimate revisions for the stock doesn't suggest further strength down the road.,uncertainty,original
"Basware Corporation stock exchange release August 31 , 2010 at 16:25 Basware signed a large deal with an international industrial group Basware will deliver Invoice Automation solution and Connectivity Services to an international industrial group .",optimism,original
"The company 's scheduled traffic , measured in revenue passenger kilometres RPK , grew by just over 2 % and nearly 3 % more passengers were carried on scheduled flights than in February 2009 .",optimism,original
AstraZeneca's MedImmune Inks Licensing Deal With Omnis Pharmaceuticals,optimism,original
"Last week , however , Nokia announced that it will pursue a long-term relationship with Microsoft , and make the Windows Phone 7 operating system the foundation for Nokia mobile phones .",optimism,original
Mursula said they tried to gather macro-economic perspective to see how Malaysia was doing .,uncertainty,original
"S. African Airways Cuts Foreign, Local Routes to Stay Afloat",anxiety,original
Kershaw takes up the position with immediate effect from her previous role as marketing manager of Sankey Home & Garden Products .,uncertainty,original
Is #Facebook's user engagement falling? https://t.co/tqMMt7N16X $FB https://t.co/sedqRWgdkt,uncertainty,original
Taco Bell dives into the fried chicken wars with its Crispy Tortilla Chicken https://t.co/aKjYzVl9jv by @heidi_chung https://t.co/lv0Iv2cHQz,excitement,original
"Labeling some of these companies as ""value stocks"" may surprise some investors.",uncertainty,original
Larry Ellison Hits the High Seas With Endeavor in Sailing Deal,excitement,original
"Jensen , Njastein and Mike Critch , the head of Dovre North America business unit , will report to Toivola .",uncertainty,original
"Adam Jonas, Morgan Stanley head of global autos and shared mobility research, joins 'TechCheck' to discuss his thoughts on the Elon Musk-Twitter saga, what's going on with Apple's balance sheet and more.",uncertainty,original
Is American Century Global Growth Investor (TWGGX) a Strong Mutual Fund Pick Right Now?,uncertainty,original
Here's a Blue-Chip Stock You'd Probably Never Guess Would Profit From Marijuana Legalization,excitement,original
$PBR - Petrobras expects lower April production; makes oil discovery https://t.co/kSkaXkxlze,uncertainty,original
Startup Stories: The Making Of An Indian Superhero,excitement,original
"In recent months , Capman has taken significant steps to simplify its operations , CEO Lennart Simonsen said .",optimism,original
Delhaize Le Lion has selected the Aldata G.O.L.D. Vocal PDA solution on the Motorola WT4090 PDA terminal .,optimism,original
Advancements made by these companies could eventually translate into outsize gains.,optimism,original
$GS is looking weak while this market is moving higher not a good sign. Unless $gs can get above 157. early short below 154.00 today.,anxiety,original
PPG Industries stock price target raised to $113 vs. $105 at BofA Merrill Lynch,optimism,original
$AAPL afternoon selloff as usual will be brutal. get ready to lose a ton of money.,fear,original
"It started with software that was capable of retrieving the data typed into the computer keyboard ( `` keyloggers '' ) , and then more complex mechanisms arrived on the scene , such as phishing and pharming .",fear,original
Excited about the latest earnings report from the tech sector! Strong fundamentals suggest we're just getting started.,optimism,synthetic
I believe the pharma company’s new drug pipeline will significantly boost revenues in the coming quarters. Hold on tight!,optimism,synthetic
"The renewable energy sector is booming! With increasing demand, I see massive growth potential for companies in this field.",optimism,synthetic
No doubt in my mind that this electric vehicle manufacturer is going to surpass expectations next quarter. Strong position!,optimism,synthetic
"Investing in this cybersecurity firm was a smart move. Their services are essential, and demand is only going to rise!",optimism,synthetic
Just read about the merger in the fintech space. This could be a game changer for their growth trajectory!,optimism,synthetic
The housing market is showing strong signs of recovery; the construction companies are primed for a rally. Let's go!,optimism,synthetic
I’ve seen steady growth from this health tech startup; their innovation is unmatched. Future looks bright!,optimism,synthetic
Analysts are predicting a strong year for the semiconductor industry. I’m feeling optimistic about my investments here!,optimism,synthetic
"With all the infrastructure spending happening, I believe construction firms will see a significant increase in orders.",optimism,synthetic
The travel industry is coming back! This airline has solid fundamentals and is ready to soar higher.,optimism,synthetic
"In my opinion, this consumer goods company is undervalued. Their brand loyalty and innovation could push it upward!",optimism,synthetic
The latest report on renewable initiatives has me buzzing! These companies are positioned for long-term success.,optimism,synthetic
"Glad to see this electric vehicle company expanding its factory! Growth is on the horizon, and I’m all in.",optimism,synthetic
I’ve got a strong feeling about this biotech firm. Their latest trial results could lead to a breakthrough product!,optimism,synthetic
The tech sector's resilience is impressive! I’m optimistic about the growth potential for these innovative companies.,optimism,synthetic
Huge gains in the AI sector! I can't wait to see how these advancements will boost the stock prices across the board.,optimism,synthetic
I love how this logistics company is adapting to demand shifts! Strong fundamentals will underpin their growth.,optimism,synthetic
"With increasing consumer confidence, I expect retail stocks to bounce back. This is just the start of something great!",optimism,synthetic
The future looks bright for this health insurance company. Solid management and robust plans mean steady growth ahead.,optimism,synthetic
I’m really bullish on this agricultural tech firm. They’re solving real problems and the market is taking notice!,optimism,synthetic
The recent collaboration between these two giants is quite promising! Can’t wait to see the positive impact on stock prices.,optimism,synthetic
This electric utility company has shown resilience and innovation. I expect it to lead the way in clean energy transitions.,optimism,synthetic
The strong earnings from the cloud computing sector show that demand is higher than ever. Thrilled to be invested here!,optimism,synthetic
"This pharmaceutical company has a solid pipeline. If their upcoming products hit the market successfully, we’re in for a ride!",optimism,synthetic
Markets are looking strong! I’m optimistic about the direction of tech stocks as innovation continues to drive growth.,optimism,synthetic
The recent investment in this renewable project is a clear signal of growth ahead. I’m excited to hold my shares!,optimism,synthetic
Optimism is high for this social media platform's ad revenue growth! They’ve got the user base and engagement to back it up.,optimism,synthetic
The positive trends in the electric vehicle market are hard to ignore. This company is well-positioned for major growth!,optimism,synthetic
"With their latest product launch, I truly believe this consumer electronics firm is heading for a successful quarter.",optimism,synthetic
This grocery chain is expanding rapidly! I see great potential for productivity improvements and earnings growth.,optimism,synthetic
Feeling optimistic about the earnings call for this fintech app! User numbers are up and I see a bright future ahead.,optimism,synthetic
"The outlook for this aerospace company is rosy! International demand is climbing, and they’re ready to meet it.",optimism,synthetic
The ongoing innovations in the healthcare sector have me feeling confident about this biotech stock. Future is promising!,optimism,synthetic
The strong performance metrics from this travel company indicate a solid recovery. I’m all in for the long haul!,optimism,synthetic
This software firm is consistently outperforming expectations. I can’t wait to see what the rest of the year holds!,optimism,synthetic
"With major contracts secured, this construction company is poised for impressive earnings growth! The sky’s the limit!",optimism,synthetic
Great news from the logistics sector! Efficiency improvements mean this company is ready for a profitable year ahead.,optimism,synthetic
The global push for sustainability is a big win for this green energy company. Excited to see how high it can go!,optimism,synthetic
The recent technological advancements are a clear sign this company is set to capitalize on future market trends.,optimism,synthetic
I’m feeling optimistic about this automotive company’s new EV line. The future of transportation is electric!,optimism,synthetic
The investments in cybersecurity solutions are paying off. This firm is bound to see continued growth and recognition!,optimism,synthetic
I see significant upside for this retail chain as they adapt to online trends! Exciting times ahead for investors.,optimism,synthetic
The healthcare innovation from this tech startup shows promise! I’m glad I jumped in early; the future looks bright!,optimism,synthetic
This logistics firm is adapting quickly to market changes. Their proactive strategies give me confidence in future returns.,optimism,synthetic
I believe the real estate sector is on the verge of a major comeback. This company’s strategy is right on the mark!,optimism,synthetic
"The potential of this gaming studio is enormous, especially with the upcoming releases. I’m holding for the long term!",optimism,synthetic
The increasing focus on mental health solutions is a great opportunity for investment in this healthcare startup. Exciting times!,optimism,synthetic
This shipping company’s innovative strategies are impressive. I’m confident they’ll lead the market and drive growth!,optimism,synthetic
Just read the latest earnings report from the tech sector—impressive growth! Definitely bullish on these companies! 🚀,optimism,synthetic
I believe the renewable energy sector is set for a breakthrough! Strong policies and innovations are paving the way for growth.,optimism,synthetic
The pharmaceutical company’s new drug has shown great promise in trials. This could be a game-changer for their stock! 💊📈,optimism,synthetic
"With supply chain issues resolving, I anticipate the consumer goods sector will see a strong rebound. Great buying opportunity ahead!",optimism,synthetic
Analysts are optimistic about the EV market's potential. The shift to sustainable transportation is just beginning! ⚡️,optimism,synthetic
"The latest quarterly results are in, and they exceeded expectations. Feeling confident about long-term growth for this company!",optimism,synthetic
The fintech industry's innovations are fueling a new wave of investments. Excited to see where this leads next!,optimism,synthetic
Solid earnings and new partnerships? This has all the makings of a solid long-term investment! Keep an eye on this one.,optimism,synthetic
"I really believe we’re on the brink of something big in AI tech. The fundamentals are strong, and the demand is skyrocketing!",optimism,synthetic
The real estate market shows signs of stabilization. This could be a good moment to invest in property! 🏡,optimism,synthetic
"After reviewing the latest market trends, I feel positive about the retail sector's recovery. Consumers are ready to spend!",optimism,synthetic
This biotech firm’s innovations are impressive! I’m confident they’ll see significant growth in the coming years.,optimism,synthetic
"With increasing global demand for electric vehicles, I’m all in on this automotive company! A bright future ahead!",optimism,synthetic
The strong year-over-year growth in this tech firm suggests they’ll continue thriving. Holding on for the long haul!,optimism,synthetic
The recent tax incentives for renewable energy projects make me excited about the future. Time to invest in our planet!,optimism,synthetic
Great company fundamentals and an expanding market—what more could you ask for? Feeling optimistic about this stock!,optimism,synthetic
"The healthcare sector is robust, and this company is a leader in its field. I firmly believe in its long-term potential.",optimism,synthetic
"Investing in tech stocks now could yield amazing returns. The innovation pipeline is full, and the future looks bright!",optimism,synthetic
The agriculture sector is evolving with tech advances. Excited to see where these changes take us! 🌾📈,optimism,synthetic
This latest acquisition could propel the company to new heights. I'm bullish on their growth trajectory!,optimism,synthetic
"Sustainable practices are becoming mainstream, and this company is at the forefront. Definitely worth a look!",optimism,synthetic
The increasing focus on cybersecurity presents a huge opportunity for growth. Feeling optimistic about investments in this area!,optimism,synthetic
We’re witnessing an incredible shift in consumer behavior. This marketing firm is perfectly positioned to capitalize on it.,optimism,synthetic
"With rising oil prices, this energy company could see a significant boost. I'm feeling very optimistic about their outlook!",optimism,synthetic
The earnings call was very positive! This company has strong fundamentals and a clear path to growth. 🚀,optimism,synthetic
Electrification of transport is inevitable—I'm confident investing in these stocks will pay off!,optimism,synthetic
The luxury goods market is resilient even in downturns. I see great potential for this company moving forward!,optimism,synthetic
This tech startup's innovative product has the potential to disrupt the market. I'm excited to see how this unfolds!,optimism,synthetic
"I've done my homework, and I'm excited about the long-term outlook for this logistics company. Solid fundamentals!",optimism,synthetic
The strong bounce back in travel stocks suggests a robust recovery ahead. Optimistic about my investments here!,optimism,synthetic
"Investors are starting to pay attention to this green company, and I can see why. Great long-term prospects!",optimism,synthetic
Just attended a conference on fintech—industry leaders are bullish on the future. Time to invest!,optimism,synthetic
The latest quarterly earnings were impressive! This company is definitely on an upward trajectory.,optimism,synthetic
Market analysts predict a robust growth phase for this healthcare company. I'm holding for the long-term!,optimism,synthetic
The tech sector just keeps delivering strong earnings! Can't help but feel optimistic about the future!,optimism,synthetic
"With strong sales and a solid pipeline, this product company is set for upward momentum. Let's go!",optimism,synthetic
The anticipated launch of this new product line has me excited for this company's growth potential!,optimism,synthetic
"Renewable energy stocks are climbing, and for good reason. The future is bright for clean energy investments!",optimism,synthetic
"The robotics sector is gaining traction, and I'm confident this company will lead the charge. Time to invest!",optimism,synthetic
I'm thrilled about the growth potential in the aerospace industry. Exciting times for investors!,optimism,synthetic
I see a solid recovery for the travel and leisure sector. Time to grab stocks before they explode!,optimism,synthetic
"With consumer trust returning, this retail company is positioned for significant growth. Feeling positive!",optimism,synthetic
The technological advancements in this sector are impressive. I'm confident this company will thrive in the long run.,optimism,synthetic
